{"attestation_id":"att_11111111111111111111111111111111","var_id":"example-state","var_version":"1.2.0","var_sha256":"aaaaaaaaaaaaaaaaaaaaaaaaaaaaaaaaaaaaaaaaaaaaaaaaaaaaaaaaaaaaaaaa","validator_sha256":"bbbbbbbbbbbbbbbbbbbbbbbbbbbbbbbbbbbbbbbbbbbbbbbbbbbbbbbbbbbbbbbb","policy":"session-cache:30m","verified_at":"2026-08-15T20:00:00Z","expires_at":"2026-08-15T20:30:00Z","status":"pass","value_sha256":"cccccccccccccccccccccccccccccccccccccccccccccccccccccccccccccccc","dependency_attestation_ids":[]}
